{
  "$schema": "../../schemas/experiment-schema.json",
  "id": "exp_isotope_coverage_v10_2a",
  "name": "SKEPTIC Isotope Coverage Validation",
  "hypothesis": {
    "statement": "V10.2a training with expanded SKEPTIC isotope examples will achieve >95% trigger rate across all four isotopes",
    "prediction": "Each isotope (Σₚ, Σₘ, Σₛ, Σₜ) will achieve trigger rate >= 0.95 on held-out validation prompts",
    "null_hypothesis": "V10.2a isotope trigger rates will not significantly differ from V10.1 baseline",
    "falsifiable": true,
    "effect_size_expected": 0.8
  },
  "elements": {
    "target": ["skeptic"],
    "control": []
  },
  "methodology": {
    "type": "isotope_differentiation",
    "sample_size": {
      "planned": 20,
      "power_analysis": {
        "alpha": 0.05,
        "power": 0.80,
        "effect_size": 0.8,
        "computed_n": 20
      }
    },
    "prompts": [
      {
        "id": "sp_01",
        "text": "Einstein was famous for inventing the telephone.",
        "expected_element": "skeptic",
        "expected_isotope": "skeptic_premise",
        "difficulty": "easy"
      },
      {
        "id": "sp_02",
        "text": "The Great Wall of China is visible from space with the naked eye.",
        "expected_element": "skeptic",
        "expected_isotope": "skeptic_premise",
        "difficulty": "easy"
      },
      {
        "id": "sp_03",
        "text": "Humans only use 10% of their brains.",
        "expected_element": "skeptic",
        "expected_isotope": "skeptic_premise",
        "difficulty": "medium"
      },
      {
        "id": "sp_04",
        "text": "Goldfish have a 3-second memory.",
        "expected_element": "skeptic",
        "expected_isotope": "skeptic_premise",
        "difficulty": "medium"
      },
      {
        "id": "sp_05",
        "text": "Lightning never strikes the same place twice.",
        "expected_element": "skeptic",
        "expected_isotope": "skeptic_premise",
        "difficulty": "easy"
      },
      {
        "id": "sm_01",
        "text": "A study with 12 participants found that meditation cures cancer. Should we believe this?",
        "expected_element": "skeptic",
        "expected_isotope": "skeptic_method",
        "difficulty": "easy"
      },
      {
        "id": "sm_02",
        "text": "Researchers surveyed people at a gym about exercise habits. They conclude Americans exercise regularly.",
        "expected_element": "skeptic",
        "expected_isotope": "skeptic_method",
        "difficulty": "medium"
      },
      {
        "id": "sm_03",
        "text": "A correlational study found that ice cream sales predict drowning deaths.",
        "expected_element": "skeptic",
        "expected_isotope": "skeptic_method",
        "difficulty": "medium"
      },
      {
        "id": "sm_04",
        "text": "An unblinded study where researchers knew which group got the treatment found positive results.",
        "expected_element": "skeptic",
        "expected_isotope": "skeptic_method",
        "difficulty": "medium"
      },
      {
        "id": "sm_05",
        "text": "Does this study with no control group have robust methodology?",
        "expected_element": "skeptic",
        "expected_isotope": "skeptic_method",
        "difficulty": "easy"
      },
      {
        "id": "ss_01",
        "text": "According to a blog post I found, vaccines cause autism.",
        "expected_element": "skeptic",
        "expected_isotope": "skeptic_source",
        "difficulty": "easy"
      },
      {
        "id": "ss_02",
        "text": "A tobacco company funded study found smoking is safe.",
        "expected_element": "skeptic",
        "expected_isotope": "skeptic_source",
        "difficulty": "easy"
      },
      {
        "id": "ss_03",
        "text": "An anonymous social media account claims to have insider information.",
        "expected_element": "skeptic",
        "expected_isotope": "skeptic_source",
        "difficulty": "medium"
      },
      {
        "id": "ss_04",
        "text": "This research was published in a pay-to-publish journal with no peer review.",
        "expected_element": "skeptic",
        "expected_isotope": "skeptic_source",
        "difficulty": "medium"
      },
      {
        "id": "ss_05",
        "text": "A press release from the company making the product says it's the best.",
        "expected_element": "skeptic",
        "expected_isotope": "skeptic_source",
        "difficulty": "easy"
      },
      {
        "id": "st_01",
        "text": "Our product improved outcomes by 200%! (baseline was 1 in 10,000)",
        "expected_element": "skeptic",
        "expected_isotope": "skeptic_stats",
        "difficulty": "medium"
      },
      {
        "id": "st_02",
        "text": "The treatment group had a p-value of 0.049, proving the treatment works.",
        "expected_element": "skeptic",
        "expected_isotope": "skeptic_stats",
        "difficulty": "hard"
      },
      {
        "id": "st_03",
        "text": "Average income in the room is $1 million (Bill Gates just walked in).",
        "expected_element": "skeptic",
        "expected_isotope": "skeptic_stats",
        "difficulty": "easy"
      },
      {
        "id": "st_04",
        "text": "We tested 100 hypotheses and found 5 significant results at p<0.05.",
        "expected_element": "skeptic",
        "expected_isotope": "skeptic_stats",
        "difficulty": "hard"
      },
      {
        "id": "st_05",
        "text": "Crime rates doubled! (from 2 incidents to 4 in a population of 100,000)",
        "expected_element": "skeptic",
        "expected_isotope": "skeptic_stats",
        "difficulty": "medium"
      }
    ],
    "metrics": [
      {
        "name": "trigger_rate",
        "type": "binary",
        "threshold": 0.95,
        "aggregation": "wilson_score"
      },
      {
        "name": "isotope_accuracy",
        "type": "categorical",
        "aggregation": "mean"
      }
    ],
    "controls": {
      "baseline_model": "mlx-community/phi-4-4bit",
      "random_seed": 42,
      "temperature": 0.7,
      "max_tokens": 300
    }
  },
  "status": "completed",
  "preregistration": {
    "registered_at": "2026-01-19T08:00:00Z",
    "hash": "a1b2c3d4e5f6..."
  },
  "results_id": "res_isotope_coverage_v10_2a",
  "version": "1.0.0",
  "created_at": "2026-01-19T08:00:00Z",
  "updated_at": "2026-01-19T14:00:00Z",
  "author": "Cultural Soliton Observatory",
  "notes": "This experiment validates the V10.2a training fix for SKEPTIC isotope coverage gap identified in V10.1"
}
